<?xml version='1.0'?>
<mpc xmlns:xsi='http://www.w3.org/2001/XMLSchema-instance' xsi:noNamespaceSchemaLocation='mpc-config.xsd'>
  <profiles>
    <profile>
      <name>default</name>
      <modules>
        <allocator>
          <numa_migration>false</numa_migration>
          <realloc_factor>2</realloc_factor>
          <realloc_threashold>50 GB</realloc_threashold>
          <numa>true</numa>
          <strict>false</strict>
          <keep_mem>500MB</keep_mem>
          <keep_max>8 MB</keep_max>
        </allocator>
        <launcher>
          <verbosity>0</verbosity>
          <banner>true</banner>
          <autokill>300</autokill>
          <user_launchers>default</user_launchers>
          <keep_rand_addr>true</keep_rand_addr>
          <disable_rand_addr>false</disable_rand_addr>
          <disable_mpc>false</disable_mpc>
          <thread_init>sctk_use_ethread_mxn</thread_init>
          <nb_task>1</nb_task>
          <nb_process>1</nb_process>
          <nb_processor>0</nb_processor>
          <nb_node>0</nb_node>
          <launcher>none</launcher>
          <max_try>10</max_try>
          <vers_details>false</vers_details>
          <profiling>none</profiling>
          <enable_smt>false</enable_smt>
          <share_node>false</share_node>
          <restart>false</restart>
          <checkpoint>false</checkpoint>
          <migration>false</migration>
          <report>false</report>
        </launcher>
        <debugger>
          <colors>true</colors>
          <max_filename_size>1024</max_filename_size>
        </debugger>
        <inter_thread_comm>
          <barrier_arity>8</barrier_arity>
          <broadcast_arity_max>32</broadcast_arity_max>
          <broadcast_max_size>1024</broadcast_max_size>
          <broadcast_check_threshold>512</broadcast_check_threshold>
          <allreduce_arity_max>8</allreduce_arity_max>
          <allreduce_max_size>1024</allreduce_max_size>
          <allreduce_check_threshold>8192</allreduce_check_threshold>
          <collectives_init_hook>sctk_collectives_init_opt_messages</collectives_init_hook>
        </inter_thread_comm>
        <low_level_comm>
          <checksum>true</checksum>
          <send_msg>sctk_network_send_message_default</send_msg>
          <notify_recv_msg>sctk_network_notify_recv_message_default</notify_recv_msg>
          <notify_matching_msg>sctk_network_notify_matching_message_default</notify_matching_msg>
          <notify_perform_msg>sctk_network_notify_perform_message_default</notify_perform_msg>
          <notify_idle_msg>sctk_network_notify_idle_message_default</notify_idle_msg>
          <notify_any_src_msg>sctk_network_notify_any_source_message_default</notify_any_src_msg>
          <network_mode>default</network_mode>
          <dyn_reordering>false</dyn_reordering>
        </low_level_comm>
        <mpc>
          <log_debug>false</log_debug>
          <hard_checking>false</hard_checking>
          <buffering>false</buffering>
        </mpc>
        <openmp>
          <vp>0</vp>
          <schedule>static</schedule>
          <nb_threads>0</nb_threads>
          <adjustment>false</adjustment>
          <nested>false</nested>
          <max_threads>64</max_threads>
          <max_alive_for_dyn>7</max_alive_for_dyn>
          <max_alive_for_guided>3</max_alive_for_guided>
          <max_alive_sections>3</max_alive_sections>
          <max_alive_single>3</max_alive_single>
        </openmp>
        <profiler>
          <file_prefix>mpc_profile</file_prefix>
          <append_date>true</append_date>
          <color_stdout>true</color_stdout>
          <level_colors>
            <level>#3A4D85</level>
            <level>#82A2FF</level>
            <level>#B8BDCB</level>
            <level>#5D6782</level>
            <level>#838383</level>
            <level>#5A5757</level>
          </level_colors>
        </profiler>
        <thread>
          <spin_delay>10</spin_delay>
          <interval>10</interval>
          <kthread_stack_size>10 MB</kthread_stack_size>
        </thread>
      </modules>
    </profile>
    <profile>
      <name>test</name>
      <modules>
        <allocator>
          <numa>false</numa>
          <keep_mem>5 MB</keep_mem>
          <keep_max>120 PB</keep_max>
        </allocator>
      </modules>
    </profile>
    <profile>
      <name>debug</name>
      <modules>
        <launcher>
          <verbosity>2</verbosity>
        </launcher>
      </modules>
    </profile>
  </profiles>
  <mappings>
    <mapping>
      <selectors>
        <env name='MPC_DEBUG'>true</env>
        <env name='MPC_GDB'>gdb</env>
      </selectors>
      <profiles>
        <profile>debug</profile>
      </profiles>
    </mapping>
    <mapping>
      <selectors>
        <env name='MPC_TEST'>true</env>
      </selectors>
      <profiles>
        <profile>test</profile>
      </profiles>
    </mapping>
  </mappings>
</mpc>
